<?xml version="1.0" encoding="UTF-8"?>
<taxiStation xmlns="http://www.example.com/taxiStation"
             xmlns:xsi="http://www.w3.org/2001/XMLSchema-instance"
             xsi:schemaLocation="http://www.example.com/taxiStation taxiStation.xsd">
    <CAR>
        <model>Audi</model>
        <regNumber>0001AA1</regNumber>
        <price>24</price>
        <rentPrice>2</rentPrice>
        <passCount>4</passCount>
        <isBabySeatAvailable>true</isBabySeatAvailable>
    </CAR>
    <MINIBUS>
        <model>VW_Transporter</model>
        <regNumber>0002AA1</regNumber>
        <price>455</price>
        <rentPrice>20</rentPrice>
        <passCount>7</passCount>
        <isBabySeatAvailable>false</isBabySeatAvailable>
        <carrying>300</carrying>
    </MINIBUS>
    <TRUCK>
        <model>Kamaz</model>
        <regNumber>0003AA1</regNumber>
        <price>785</price>
        <rentPrice>400</rentPrice>
        <carrying>4000</carrying>
    </TRUCK>
    <CAR>
        <model>Audi</model>
        <regNumber>0004AA1</regNumber>
        <price>24</price>
        <rentPrice>2</rentPrice>
        <passCount>4</passCount>
        <isBabySeatAvailable>true</isBabySeatAvailable>
    </CAR>
    <MINIBUS>
        <model>VW_Transporter</model>
        <regNumber>0005AA1</regNumber>
        <price>455</price>
        <rentPrice>20</rentPrice>
        <passCount>7</passCount>
        <isBabySeatAvailable>false</isBabySeatAvailable>
        <carrying>300</carrying>
    </MINIBUS>
    <TRUCK>
        <model>Kamaz</model>
        <regNumber>0006AA1</regNumber>
        <price>785</price>
        <rentPrice>400</rentPrice>
        <carrying>4000</carrying>
    </TRUCK>
    <CAR>
        <model>Audi</model>
        <regNumber>0007AA1</regNumber>
        <price>24</price>
        <rentPrice>2</rentPrice>
        <passCount>4</passCount>
        <isBabySeatAvailable>true</isBabySeatAvailable>
    </CAR>
    <MINIBUS>
        <model>VW_Transporter</model>
        <regNumber>0008AA1</regNumber>
        <price>455</price>
        <rentPrice>20</rentPrice>
        <passCount>7</passCount>
        <isBabySeatAvailable>false</isBabySeatAvailable>
        <carrying>300</carrying>
    </MINIBUS>
    <TRUCK>
        <model>Kamaz</model>
        <regNumber>0009AA1</regNumber>
        <price>785</price>
        <rentPrice>400</rentPrice>
        <carrying>4000</carrying>
    </TRUCK>
    <CAR>
        <model>Audi</model>
        <regNumber>0010AA1</regNumber>
        <price>24</price>
        <rentPrice>2</rentPrice>
        <passCount>4</passCount>
        <isBabySeatAvailable>true</isBabySeatAvailable>
    </CAR>
    <MINIBUS>
        <model>VW_Transporter</model>
        <regNumber>0011AA1</regNumber>
        <price>455</price>
        <rentPrice>20</rentPrice>
        <passCount>7</passCount>
        <isBabySeatAvailable>false</isBabySeatAvailable>
        <carrying>300</carrying>
    </MINIBUS>
    <TRUCK>
        <model>Kamaz</model>
        <regNumber>0012AA1</regNumber>
        <price>785</price>
        <rentPrice>400</rentPrice>
        <carrying>4000</carrying>
    </TRUCK>
    <CAR>
        <model>Audi</model>
        <regNumber>0013AA1</regNumber>
        <price>24</price>
        <rentPrice>2</rentPrice>
        <passCount>4</passCount>
        <isBabySeatAvailable>false</isBabySeatAvailable>
    </CAR>
    <MINIBUS>
        <model>VW_Transporter</model>
        <regNumber>0014AA1</regNumber>
        <price>455</price>
        <rentPrice>20</rentPrice>
        <passCount>7</passCount>
        <isBabySeatAvailable>true</isBabySeatAvailable>
        <carrying>300</carrying>
    </MINIBUS>
    <TRUCK>
        <model>Kamaz</model>
        <regNumber>0015AA1</regNumber>
        <price>785</price>
        <rentPrice>400</rentPrice>
        <carrying>4000</carrying>
    </TRUCK>

</taxiStation>